{
  "agentryTheme": 2,
  "name": "Modern",
  "basedOn": "modern",
  "version": 1,
  "paper": "a4",
  "fonts": {
    "headings": "Inter",
    "body": "Inter",
    "code": "JetBrains Mono"
  },
  "accent": "#1f6feb",
  "titleBlock": "band",
  "headings": "bar",
  "tables": {
    "tinted": true,
    "banded": true
  },
  "quotes": "callout",
  "footer": {
    "pageNumbers": "nOfN",
    "text": ""
  }
}
